{
  "$schema": "http://json-schema.org/draft-07/schema#",
  "title": "A life — content/lives/",
  "description": "One file per life. The NN- filename prefix fixes shelf order, and for a life it is also the life's number (`no`), printed on the site: lives join the end of the shelf and are never renumbered.",
  "type": "object",
  "additionalProperties": false,
  "required": ["id", "no", "n", "years", "field", "cover", "lede", "copy", "keep"],
  "properties": {
    "id": {
      "type": "string", "pattern": "^[a-z0-9]+(-[a-z0-9]+)*$", "x-means": "slug",
      "description": "The permalink — and the portrait's filename: assets/plates/<id>.jpg. Renaming it breaks every `across` link pointing here and orphans the plate."
    },
    "no": {
      "type": "integer", "minimum": 1, "x-means": ["number", "life number"],
      "description": "The life's number, printed as \u2116 48 on the shelf, the entry and its share card: the founding shelf (1–26, in its own order) first, then each life in the order it joined, like an episode number. Permanent once printed. It must match the filename prefix (48- for 48), so reordering the files cannot silently renumber anyone. `npm run new life` writes the next one."
    },
    "keep": {
      "type": "string", "maxLength": 220, "x-means": "takeaway",
      "description": "The one line to keep from this life, drawn from the entry's own argument. One sentence that makes sense read alone."
    },
    "n": { "type": "string", "x-means": "name", "description": "The person's name as shown: \"Mohandas K. Gandhi\"." },
    "plateless": {
      "type": "string", "maxLength": 300, "x-means": "no portrait, on purpose",
      "description": "Set this only when the house has decided a life gets the press mark rather than a plate, and say why in one line. `npm run stats` then stops listing it as a gap — a warning that is permanently wrong is how you learn to ignore warnings. Never use it to silence a portrait that simply has not been made yet."
    },
    "plateOf": {
      "type": "string", "maxLength": 160, "x-means": ["plate caption", "what the plate shows"],
      "description": "The plate's caption: who made the image, when, and where it is held, from the image's own record — \"Engraving by John Chester Buttre, about 1855.\" Without it the plate prints only \"Plate · <name>\". When the plate is an object from the life rather than a likeness — a boat, a manuscript — because no portrait can be used, say so plainly. It replaces \"Portrait of …\" as the image's description and prints under the plate, on the entry and on its share card, so nobody takes the object for the person. Say what it is, when, and where it is held, from the image's own record: \"Submarine B-59 … U.S. Navy photograph — the boat, not the man.\""
    },
    "years": { "type": "string", "x-means": "lived", "description": "Lived, shown as 'Lived' in the reader: \"1869–1948\", \"c. 69–30 BC\"." },
    "place": { "type": "string", "x-means": "where", "description": "Where, printed beside the field: \"India\"." },
    "field": { "type": "string", "description": "The field, e.g. \"Politics & Ethics\"." },
    "group": {
      "enum": ["famous", "obscure"],
      "description": "Which shelf filter it sits under: famous, or obscure-but-pivotal."
    },
    "cover": { "$ref": "title.schema.json#/definitions/colour", "description": "Livery: the cover colour, #RRGGBB." },
    "spineC": { "$ref": "title.schema.json#/definitions/colour", "description": "Livery: the spine colour — a shade darker than `cover`." },
    "ink": { "$ref": "title.schema.json#/definitions/colour", "description": "Livery: the lettering colour on the cover." },
    "accent": { "$ref": "title.schema.json#/definitions/colour", "description": "Livery: the accent colour." },
    "motif": { "enum": ["rings", "lines", "grid", "dots", "conic"], "description": "The pattern pressed into the cover, tone on tone in the lower part of the board: lines draws waves, rings ripples, grid a chart's graticule, dots a row of pennants, conic a low sun on the horizon. Anything unrecognised prints as conic." },
    "lede": { "type": "string", "x-means": "hook", "description": "The opening line." },
    "copy": {
      "type": "array", "minItems": 1, "items": { "type": "string" }, "x-means": "body",
      "description": "The life, one string per paragraph: the situation, what they actually did, the cost or the part usually left out. Keep each paragraph on one line."
    },
    "facts": { "$ref": "title.schema.json#/definitions/facts" },
    "bio": {
      "type": "object", "additionalProperties": false, "required": ["t", "a"], "x-means": "book",
      "description": "The one biography to read.",
      "properties": {
        "t": { "type": "string", "x-means": "title", "description": "Exact title. The site turns it into a WorldCat search, so a typo breaks the link." },
        "a": { "type": "string", "x-means": "author", "description": "Exact author." },
        "y": { "type": "string", "x-means": "year", "description": "Year published, as text: \"2013 / 2018\"." },
        "u": { "type": "string", "format": "uri", "x-means": ["url", "link"], "description": "Only when the place to start is not a book — an article, an exhibition, an archive. The reader then links it directly and heads the section \"Where to start\" instead of offering a library search for a book that does not exist." },
        "why": { "type": "string", "description": "Why this book and not the famous one." }
      }
    },
    "corrected": { "type": "array", "items": { "type": "integer", "minimum": 1 }, "x-means": ["corrections", "correction"], "description": "The numbers of the colophon corrections that apply to this entry, e.g. [2]. The reader prints them on the entry, so someone reading it learns it was corrected and what changed. Add the number in the same change that runs `npm run correct`." },
    "contested": { "type": "string", "x-means": "dispute", "description": "What is disputed about this life, and by whom — the strongest critique, named." },
    "across": { "$ref": "title.schema.json#/definitions/across" }
  }
}
