{
  "id": "maurice-hilleman",
  "no": 19,
  "keep": "Work can outrun credit and still be worth doing — eight of fourteen childhood vaccines say so.",
  "n": "Maurice Hilleman",
  "years": "1919–2005",
  "place": "United States",
  "field": "Microbiology & Vaccines",
  "group": "obscure",
  "cover": "#914417",
  "spineC": "#71320E",
  "ink": "#FCEEE0",
  "accent": "#F7D2AB",
  "motif": "dots",
  "lede": "If lives saved were the measure of fame, he would be a household name.",
  "copy": [
    "A blunt, hard-driving Montana farm boy, Hilleman nearly didn't go to college. He is often called the most productive vaccine scientist who ever lived. He developed more than forty vaccines — measles, mumps, rubella, hepatitis A and B, chickenpox, meningitis and pneumonia among them.",
    "Eight of the fourteen vaccines routinely recommended for children today came from his lab. When his own daughter woke with mumps in 1963, he swabbed her throat, cultured the virus and turned it into the vaccine still used. The strain is named “Jeryl Lynn” after her. During the 1957 flu pandemic he recognized the threat early and pushed industry to produce forty million doses, blunting the outbreak in the United States.",
    "He worked in deliberate obscurity, indifferent to credit. That is precisely why so few people know the name of the man who may have prevented more deaths than anyone in history."
  ],
  "facts": [
    {
      "b": "40 million",
      "s": "Doses of vaccine given in the three months after his 1957 warning: J. Cavanaugh Simpson, 'The Man Who Beat the 1957 Flu Pandemic', Scientific American, 19 April 2020; Montana State University, 'The Man Who Saved Millions'"
    }
  ],
  "bio": {
    "t": "Vaccinated: One Man's Quest to Defeat the World's Deadliest Diseases",
    "a": "Paul A. Offit",
    "y": "2007",
    "why": "Offit, himself a vaccine inventor, interviewed Hilleman extensively in his final months. Both a biography of an irascible genius and a clear-eyed history of how vaccines are made."
  },
  "contested": "Offit is a colleague and a public vaccine advocate, and the book is admiring by design — there is no critical distance here. The frequently quoted 'eight million lives a year' figure is an estimate with a wide range, not a measured quantity.",
  "across": [
    {
      "to": "lives:henrietta-lacks",
      "label": "Henrietta Lacks",
      "txt": "— the other half of the same ledger, where the credit and the consent ran to different people."
    },
    {
      "to": "lives:norman-borlaug",
      "label": "Norman Borlaug",
      "txt": "— the other life on this shelf measured in lives saved, and the other name almost nobody knows."
    },
    {
      "to": "lives:tu-youyou",
      "label": "Tu Youyou",
      "txt": "— the same shelf of the unnamed: a malaria drug, and a prize that settled the credit only on paper."
    },
    {
      "to": "lives:karl-landsteiner",
      "label": "Karl Landsteiner",
      "txt": "— who sorted human blood into groups in 1901, the reason a transfusion can be matched."
    }
  ],
  "corrected": [
    15
  ]
}
